code,title,description,quantity,price,cost,sold
33504,Game Device,"Morbi sit amet molestie turpis, convallis facilisis sapien. Suspendisse vitae venenatis orci. Ut eleifend quis quam id mattis. Nulla ac libero felis. Fusce elit mi, tincidunt quis nisl commodo, ultrices ornare sem. Phasellus purus mauris, bibendum sit amet leo eu, tempor vestibulum neque. Pellentesque lacinia nisl rutrum tempor tincidunt. Proin vehicula felis non ligula sollicitudin placerat ut nec mauris. Ut cursus vehicula fringilla. Curabitur egestas molestie tortor, vitae maximus velit auctor in. Sed quis cursus turpis, lacinia interdum dolor. Morbi et dui justo. Ut facilisis a massa vitae porttitor. Cras mauris orci, ornare in ex sed, dapibus semper mauris. Proin in sapien est.",108,81.95,72,55
43073,Hair Care Whatchamacallit,"Duis fermentum vestibulum elit aliquet pharetra. Aliquam vel malesuada metus. Suspendisse potenti. Morbi semper fermentum mauris, aliquam suscipit metus fermentum nec. Nunc eget libero sed dui iaculis eleifend quis sed tellus. Vivamus aliquet commodo magna id viverra. Morbi vitae neque vitae risus viverra elementum non et tellus. Maecenas laoreet tellus augue, id dictum magna dictum non. Suspendisse lorem augue, dapibus ac arcu quis, molestie accumsan enim. In lacus justo, sollicitudin vel orci vitae, ornare pretium odio. Etiam feugiat maximus nulla ut bibendum.",226,85.95,59.95,203
54692,Bedding Mechanism,"Nulla orci mi, dapibus vel tempor vulputate, luctus at quam. Curabitur tempus sed mi eget pretium. Sed vitae eleifend nibh. Integer luctus orci vel metus elementum, sit amet rutrum nisi cursus. Cras sagittis eu magna et bibendum. Aliquam erat volutpat. Pellentesque sollicitudin ornare egestas. Fusce libero quam, elementum non auctor ultricies, vulputate non sem. Integer tristique est a lorem consectetur tempor.",119,57.99,39,242
46852,Swimming Doodad,"Cras metus ipsum, viverra vel ligula in, finibus eleifend odio. Morbi odio eros, euismod eget sapien non, placerat vehicula ex. Ut non nisi felis. In scelerisque tincidunt erat vel finibus. Vestibulum ut aliquam orci. Duis blandit vel lacus eget aliquet. Donec lacinia, elit sed tincidunt dictum, mi nisl cursus arcu, et fermentum diam sem eget purus. Nunc nec felis leo. Vivamus dictum lorem id lacus convallis lacinia quis nec quam. Maecenas faucibus sed nisi eu molestie. Fusce elementum ultrices risus, quis porttitor dolor porttitor nec. Duis convallis ante ipsum, id suscipit sem ultricies quis. Sed vel rhoncus tellus. Ut sed tincidunt nibh, non cursus nunc.",165,15.99,9,199
58106,Toy Gadget,,169,114.99,102.95,56
51925,Dog Gear,"Lorem ipsum dolor sit amet, consectetur adipiscing elit. Maecenas vulputate libero eget quam dictum, ac pellentesque enim commodo. Donec tincidunt ligula in nunc fermentum, nec posuere arcu convallis. Pellentesque habitant morbi tristique senectus et netus et malesuada fames ac turpis egestas. Mauris magna risus, scelerisque in lacinia non, pulvinar nec nulla. Duis a sapien mi. Nullam vitae purus a justo venenatis euismod. Donec euismod tincidunt arcu, sit amet euismod purus placerat non. Etiam ac tempus felis. Nulla facilisi. Etiam sodales, nisi eu tincidunt lacinia, massa lectus mollis ligula, eget rutrum enim nibh ac nulla. Vestibulum porta egestas vulputate. Sed non laoreet nisl. Aenean hendrerit venenatis auctor.",173,52.95,41.95,85
32805,Toy Doodad,"Suspendisse placerat non erat quis aliquam. Maecenas pulvinar sollicitudin pretium. Class aptent taciti sociosqu ad litora torquent per conubia nostra, per inceptos himenaeos. In gravida ligula in sapien blandit volutpat. Suspendisse porttitor dolor et neque condimentum, non consequat ligula commodo. Aenean ultricies nisl mauris, ac gravida dolor tempus et. Nullam et malesuada justo, ac scelerisque libero. Sed ultrices nunc enim. Integer posuere nulla egestas dignissim faucibus. Integer egestas augue quis sodales dictum.",48,11.99,6,45
27509,Skin Care Widget,"Donec elementum volutpat porttitor. Phasellus eget lectus vitae neque convallis accumsan. Cras aliquam lobortis metus id pulvinar. Pellentesque ut volutpat augue. Phasellus feugiat tristique est, vitae laoreet libero maximus quis. Nam fringilla aliquet tellus ac pretium. Quisque pulvinar augue eget nunc mollis, nec luctus ex lobortis. Phasellus a sagittis justo. Cras placerat sem in eros bibendum dapibus et ut nulla. Nulla cursus libero odio, vel volutpat diam vulputate eu. Proin id dolor dolor. Integer ut vehicula odio, eget rhoncus tellus. Integer quis tristique magna, eu fringilla lorem. Cras vehicula, justo sit amet congue fringilla, quam augue interdum nulla, at pretium massa tellus in arcu. Pellentesque vel suscipit metus.",158,103,72.95,140
33131,Swimming Item,"Pellentesque iaculis turpis felis, eu vestibulum tellus molestie ut. Orci varius natoque penatibus et magnis dis parturient montes, nascetur ridiculus mus. Phasellus molestie, nisi sit amet blandit gravida, felis libero ultrices risus, vel tincidunt nulla dolor sed ipsum. Integer est tortor, laoreet vitae neque eget, maximus bibendum lacus. Quisque odio ante, faucibus id sem a, vehicula elementum magna. Donec egestas id ligula eu euismod. Nullam aliquam justo a arcu malesuada, sed pulvinar mauris luctus. Nunc egestas elementum laoreet. Sed accumsan pretium interdum. Praesent maximus cursus imperdiet. Vestibulum libero purus, finibus eu maximus a, fermentum eget ex.",101,26.95,20.95,224
368,Computer Accessory,"Donec elementum volutpat porttitor. Phasellus eget lectus vitae neque convallis accumsan. Cras aliquam lobortis metus id pulvinar. Pellentesque ut volutpat augue. Phasellus feugiat tristique est, vitae laoreet libero maximus quis. Nam fringilla aliquet tellus ac pretium. Quisque pulvinar augue eget nunc mollis, nec luctus ex lobortis. Phasellus a sagittis justo. Cras placerat sem in eros bibendum dapibus et ut nulla. Nulla cursus libero odio, vel volutpat diam vulputate eu. Proin id dolor dolor. Integer ut vehicula odio, eget rhoncus tellus. Integer quis tristique magna, eu fringilla lorem. Cras vehicula, justo sit amet congue fringilla, quam augue interdum nulla, at pretium massa tellus in arcu. Pellentesque vel suscipit metus.",164,102,91,3
39330,Book Whatchamacallit,"Phasellus ut ante eleifend, ultrices massa non, varius diam. Nulla vestibulum maximus justo eget efficitur. Vivamus interdum bibendum sapien, quis aliquam diam ultricies nec. Nunc dui metus, ultricies vel orci ut, scelerisque consectetur magna. Nam commodo pulvinar augue vel euismod. Quisque nibh odio, posuere sed molestie eu, mollis nec velit. Praesent sit amet tempor libero. Donec eu lorem lectus. Nam scelerisque eleifend lorem ut efficitur.",84,194.95,174.99,174
46190,Home Improvement Item,"Pellentesque dictum ante vitae tempor sodales. Phasellus sed egestas felis, id sagittis ipsum. Sed pharetra non urna quis luctus. Aenean iaculis iaculis augue, eget rutrum justo aliquet dapibus. Proin convallis vel tellus a bibendum. Duis sagittis ultrices orci vitae feugiat. Donec vehicula cursus diam at varius. Sed non varius nunc, at gravida est. Cras sodales varius metus ut dignissim. In hac habitasse platea dictumst. Aliquam diam quam, consequat et vestibulum vel, elementum nec elit. Nulla et viverra felis. In eget dolor non metus fermentum scelerisque.",233,92,82,32
14944,Aquarium Supplies,"Vivamus eu lacus magna. Fusce sollicitudin maximus ante sed semper. Nulla facilisi. Suspendisse ultricies mi eget nisi vehicula, at aliquam nunc interdum. Nulla neque tellus, ultrices non consequat vitae, vehicula vulputate orci. Vivamus iaculis urna non enim maximus condimentum. Aliquam porttitor egestas viverra. Suspendisse elementum magna mauris, vitae vestibulum orci porttitor quis. Interdum et malesuada fames ac ante ipsum primis in faucibus. Pellentesque vehicula efficitur libero. In bibendum scelerisque lectus, sed vulputate diam gravida nec. Nulla congue bibendum velit dictum pulvinar. Cras pharetra libero a tempor tincidunt. Mauris eget ullamcorper nibh.",199,149.99,134.99,115
31287,Skin Care Thingamajig,"Vestibulum lacinia massa nec viverra vulputate. Cras a ante sem. Morbi interdum lobortis lacus id ullamcorper. Integer pellentesque fringilla libero quis cursus. Curabitur vitae dictum nibh, non accumsan turpis. Quisque aliquam nec nibh a aliquam. Curabitur nunc arcu, rutrum eget mattis id, semper in mi. In arcu augue, commodo sit amet finibus eget, dignissim in quam. Nulla sollicitudin enim in nibh venenatis, in cursus dui hendrerit. Morbi at mollis nulla.",77,86.99,68,43
2741,Furniture Device,"Sed non fermentum erat, et venenatis ipsum. Aliquam eleifend imperdiet volutpat. Aliquam egestas ipsum mauris, et commodo dui consectetur quis. Vestibulum rhoncus nulla quis feugiat interdum. In imperdiet purus metus, id condimentum lectus ultricies vel. Curabitur ut interdum nisi. In sed nunc suscipit, luctus mauris eu, congue sapien. Suspendisse ornare quis odio eget suscipit. In accumsan urna nunc, non mattis enim blandit ut. In ut libero orci. Ut semper velit ut elit ullamcorper, ac vulputate libero rutrum. Praesent justo leo, eleifend a molestie vestibulum, bibendum sit amet leo. Sed interdum et tortor ut laoreet. Nulla in tellus augue. Aenean sit amet felis id purus commodo auctor id non odio. Donec interdum, lorem consectetur condimentum mollis, mauris sem pretium turpis, sed faucibus magna tortor a erat.",210,65.95,39,11
38446,Gardening Doodad,"Sed ut eros quam. Aenean imperdiet nulla ante, vel tempor dolor consectetur quis. Sed sed justo odio. Proin et cursus mauris. Integer quis neque et lacus imperdiet mattis eget ac lacus. Nunc faucibus nec diam mattis semper. Pellentesque dictum neque purus, non cursus enim venenatis vitae. Maecenas sed venenatis purus, quis viverra turpis. In hac habitasse platea dictumst. Nam sit amet ornare sapien, eleifend fermentum augue.",8,106.95,63,244
36392,Kitchen Gear,"Nulla facilisi. Aliquam imperdiet bibendum nisi vitae condimentum. Suspendisse eleifend nibh in enim ornare, id tempus orci dapibus. Proin sed scelerisque neque. Vestibulum blandit mi quis leo euismod faucibus. Vestibulum eget libero eget nibh sodales vehicula vitae ut est. Integer vel commodo massa, eget imperdiet sapien. Mauris auctor elementum nibh, ac vehicula leo pellentesque quis. Cras pulvinar ipsum vulputate, hendrerit quam ut, ullamcorper lectus.",166,30,27.99,141
65375,Medicine Device,"Sed ac commodo ligula. Morbi suscipit mi eget tortor euismod, a congue nibh finibus. Ut dapibus ut odio sit amet vehicula. Nulla congue posuere ligula ac pulvinar. Suspendisse potenti. Nulla libero odio, suscipit ut mattis non, tempor molestie diam. Nam sed ex mollis, luctus nisi at, rhoncus sapien. Integer eu ligula metus. Orci varius natoque penatibus et magnis dis parturient montes, nascetur ridiculus mus.",54,181,126.95,249
35443,Camera Paraphernalia,"Nam lorem arcu, pretium quis lectus et, volutpat euismod enim. Suspendisse semper tortor sapien, eu cursus nisi fermentum non. Cras quam orci, tincidunt quis purus vel, molestie posuere urna. Etiam lobortis neque eget ex tempus, eu interdum mi semper. Cras felis enim, rutrum a imperdiet et, vehicula at metus. Praesent bibendum, augue eu aliquam gravida, lectus sapien fringilla ipsum, non tincidunt leo felis eu augue. Aliquam faucibus tortor enim, in convallis elit euismod quis.",67,68,47,78
59576,Jewelry Device,"Phasellus eu pulvinar tortor. Donec nec purus et massa hendrerit finibus. Sed eu felis pretium, tincidunt risus quis, tempus lorem. Duis consequat vel erat placerat elementum. Donec sodales maximus lectus, vitae blandit eros congue a. Pellentesque dignissim mi a sem dapibus eleifend. Sed eu dignissim diam. Pellentesque posuere imperdiet maximus. Fusce quis dui sed ligula viverra tempus in ac orci. Curabitur tincidunt placerat ante, ac venenatis tellus ullamcorper cursus.",254,21.95,12.99,214
27157,Baby Gizmo,"Cras placerat felis at diam feugiat placerat. Donec lectus elit, gravida sit amet elit in, feugiat auctor dui. Sed aliquam accumsan libero, vitae aliquet metus mattis non. Quisque sit amet nunc euismod, faucibus arcu sit amet, sollicitudin mi. Nullam aliquam rutrum purus. Donec convallis, libero pretium accumsan viverra, felis diam venenatis massa, et vulputate magna nibh et urna. Nulla tempus arcu a libero semper ultricies. Praesent ante tortor, auctor in eleifend a, ornare vitae odio. Nam justo velit, venenatis nec sapien ac, porttitor fringilla nunc. Ut quis leo ornare, posuere nisl sit amet, pellentesque augue.",1,125.95,75,214
50275,Camera Equipment,"Maecenas maximus condimentum efficitur. Phasellus vitae ullamcorper lectus, non mattis augue. Phasellus vel efficitur ipsum. Praesent tempus porttitor ante, ut efficitur diam mollis vel. Vestibulum quis accumsan turpis. Integer accumsan, felis quis fringilla dignissim, nisl magna pulvinar lacus, nec aliquam mauris enim ut risus. In ultrices tempus nibh, rutrum dictum quam faucibus quis. Donec ut nunc nec nisl elementum consectetur.",41,26.95,23.99,181
510,Car Machine,"Integer tempor metus convallis lorem dignissim, vel porttitor mauris varius. Vestibulum sagittis dolor nec sodales rutrum. Interdum et malesuada fames ac ante ipsum primis in faucibus. Etiam quis tortor vel ex egestas varius a et metus. Sed ultrices urna turpis, et tempus dolor dignissim et. Integer placerat quis nulla ac vestibulum. Sed at faucibus libero. Aenean hendrerit lorem euismod turpis consectetur cursus. Mauris venenatis odio sit amet enim imperdiet pulvinar. Phasellus dignissim risus vitae tellus elementum convallis. Pellentesque elementum est lectus, vel feugiat urna malesuada sit amet. Proin quis enim ac ipsum fermentum iaculis sed vel sapien. Maecenas quis libero eget nisl faucibus laoreet.",21,39.99,35.95,125
22214,Car Accessory,"Quisque nec imperdiet lectus. Aliquam justo dolor, vestibulum ac sem nec, facilisis ornare arcu. Nulla cursus dignissim risus et vulputate. Sed placerat urna quis leo sollicitudin efficitur non vitae risus. Quisque fringilla maximus nulla condimentum eleifend. Proin commodo varius lorem nec venenatis. Aliquam ipsum massa, posuere vestibulum venenatis sit amet, sagittis ac nunc.",64,141,112.95,238
15021,Bedding Device,"Pellentesque fermentum facilisis hendrerit. Vivamus venenatis dapibus sem, sit amet placerat tortor blandit eget. Nullam id augue vitae nulla interdum pharetra ut et turpis. Etiam nisl mauris, feugiat malesuada mi sed, vestibulum commodo lectus. Donec convallis ac tortor vitae tincidunt. Praesent ut ligula elit. Morbi eget mi ex. Curabitur quis dignissim eros. Suspendisse id massa at velit maximus ultrices. Suspendisse euismod rhoncus sapien, sit amet pretium arcu mollis a. Cras commodo lacus erat, gravida congue ipsum condimentum nec. In lacinia nunc sagittis mauris ullamcorper interdum. Pellentesque ac risus consequat orci congue malesuada in nec mi. Donec eleifend id nunc quis semper. Sed consequat metus non accumsan rutrum.",252,188.95,131.95,231
31070,Womens Instrument,"Praesent sit amet sem tempor, blandit risus id, aliquam metus. Fusce convallis consequat sodales. Nam dignissim consequat finibus. Sed condimentum finibus neque, ut tincidunt ipsum lobortis vel. Vivamus sed rutrum nisl, sed hendrerit ipsum. Nullam volutpat ut dui nec gravida. In non malesuada tortor. Nullam gravida nulla vel ante condimentum volutpat. Donec et odio ac leo elementum lacinia. Integer consequat vulputate dolor a maximus. Maecenas ut commodo lacus. Donec dictum est nec auctor condimentum. Nam maximus dapibus lacus ut ultricies. Praesent vulputate dapibus risus, quis suscipit arcu pellentesque eget. Nam malesuada lorem ut lacus tincidunt, id pellentesque velit pulvinar. Nulla facilisi.",36,18.99,14.95,69
24771,Home Improvement Contraption,"Morbi sit amet molestie turpis, convallis facilisis sapien. Suspendisse vitae venenatis orci. Ut eleifend quis quam id mattis. Nulla ac libero felis. Fusce elit mi, tincidunt quis nisl commodo, ultrices ornare sem. Phasellus purus mauris, bibendum sit amet leo eu, tempor vestibulum neque. Pellentesque lacinia nisl rutrum tempor tincidunt. Proin vehicula felis non ligula sollicitudin placerat ut nec mauris. Ut cursus vehicula fringilla. Curabitur egestas molestie tortor, vitae maximus velit auctor in. Sed quis cursus turpis, lacinia interdum dolor. Morbi et dui justo. Ut facilisis a massa vitae porttitor. Cras mauris orci, ornare in ex sed, dapibus semper mauris. Proin in sapien est.",113,45,36,53
3233,Aquarium Gizmo,"Morbi nulla massa, accumsan ut congue tempus, aliquam sit amet libero. Mauris euismod, est nec consectetur blandit, diam nisi lobortis enim, vitae suscipit libero erat hendrerit sapien. Nam vel sapien ipsum. Quisque sagittis lectus lacinia orci aliquet sollicitudin. Integer convallis turpis vitae condimentum tincidunt. Phasellus quis erat at sem dignissim tempor eu quis purus. Sed viverra ullamcorper volutpat.",225,195,136.99,123
28705,Cooking Mechanism,"Maecenas maximus condimentum efficitur. Phasellus vitae ullamcorper lectus, non mattis augue. Phasellus vel efficitur ipsum. Praesent tempus porttitor ante, ut efficitur diam mollis vel. Vestibulum quis accumsan turpis. Integer accumsan, felis quis fringilla dignissim, nisl magna pulvinar lacus, nec aliquam mauris enim ut risus. In ultrices tempus nibh, rutrum dictum quam faucibus quis. Donec ut nunc nec nisl elementum consectetur.",212,178,142.95,45
36164,Computer Doodad,"Sed ac commodo ligula. Morbi suscipit mi eget tortor euismod, a congue nibh finibus. Ut dapibus ut odio sit amet vehicula. Nulla congue posuere ligula ac pulvinar. Suspendisse potenti. Nulla libero odio, suscipit ut mattis non, tempor molestie diam. Nam sed ex mollis, luctus nisi at, rhoncus sapien. Integer eu ligula metus. Orci varius natoque penatibus et magnis dis parturient montes, nascetur ridiculus mus.",195,135.95,121.99,124
63875,Movie Rig,"Morbi sit amet molestie turpis, convallis facilisis sapien. Suspendisse vitae venenatis orci. Ut eleifend quis quam id mattis. Nulla ac libero felis. Fusce elit mi, tincidunt quis nisl commodo, ultrices ornare sem. Phasellus purus mauris, bibendum sit amet leo eu, tempor vestibulum neque. Pellentesque lacinia nisl rutrum tempor tincidunt. Proin vehicula felis non ligula sollicitudin placerat ut nec mauris. Ut cursus vehicula fringilla. Curabitur egestas molestie tortor, vitae maximus velit auctor in. Sed quis cursus turpis, lacinia interdum dolor. Morbi et dui justo. Ut facilisis a massa vitae porttitor. Cras mauris orci, ornare in ex sed, dapibus semper mauris. Proin in sapien est.",156,121,84.99,32
24467,Mens Contraption,"Nunc pharetra, tortor eu placerat sagittis, ligula eros gravida neque, luctus interdum purus ipsum et diam. Phasellus quis leo vitae sem commodo tempus a at odio. Nam venenatis metus nibh, malesuada vestibulum purus consectetur eu. Morbi at tincidunt leo, eu rutrum lorem. Pellentesque quis mollis tortor. Interdum et malesuada fames ac ante ipsum primis in faucibus. Phasellus sed erat ac lorem facilisis fermentum. Cras venenatis diam in mi sodales commodo. Integer vitae ipsum sed erat tincidunt euismod in a odio. Donec lacus sapien, mollis nec consequat at, sodales sit amet orci. Donec fermentum neque orci, ac lobortis metus suscipit non. Phasellus vehicula mauris vitae ante rhoncus, et volutpat sapien faucibus. Mauris auctor libero eu hendrerit consectetur. Pellentesque elementum, velit id iaculis fermentum, felis velit molestie neque, at pharetra leo risus vitae mi. In tempor tortor sit amet leo sollicitudin, ultrices commodo turpis posuere. Donec molestie fermentum velit, in blandit lectus pharetra vitae.",162,197.95,157,51
63131,Cleaning Widget,"In eu interdum sapien. In scelerisque hendrerit sem ac mollis. Sed rutrum lobortis erat finibus aliquam. Sed in lacus ante. Nam eget aliquet magna. Etiam nec malesuada tellus. Suspendisse posuere, risus nec suscipit laoreet, tellus dui imperdiet ligula, efficitur elementum leo orci vitae nisl. Vestibulum eleifend egestas enim ut condimentum. Proin vitae rutrum nibh. Fusce rutrum erat mattis sem molestie, eget lobortis neque dapibus. Nulla in diam ut magna semper varius.",182,81.99,72.95,11
60619,Medicine Machine,"Mauris justo ligula, gravida eget posuere eget, ultrices ut augue. Vestibulum sed est a sapien porttitor venenatis. Curabitur non nisl at tortor elementum condimentum. Fusce finibus nibh vel condimentum fermentum. Cras dignissim molestie sodales. Etiam a finibus risus. In dictum, libero sit amet mollis aliquam, nulla nunc mollis felis, eu pharetra justo tellus id ligula. Etiam sollicitudin enim eu nisl ullamcorper sagittis. Nam ac ultrices mi. In bibendum quam sed ante vehicula feugiat. Quisque scelerisque venenatis velit, eu porttitor felis mattis non. Donec molestie sodales efficitur.",10,162,113.95,155
5863,Mens Whatchamacallit,"Curabitur tristique vehicula vestibulum. Etiam blandit dictum ex, malesuada commodo lectus gravida ac. Morbi a augue quam. Aenean volutpat condimentum efficitur. Nunc ut purus vestibulum, tincidunt nunc in, congue ante. Sed consequat felis sed elementum semper. Curabitur tincidunt mollis lacus, sit amet tincidunt eros sodales sit amet. Maecenas condimentum eros eget vestibulum aliquam. Phasellus sapien lorem, mollis vel lectus vel, bibendum fermentum ligula. Morbi sollicitudin suscipit felis, a commodo justo fringilla id.",119,124.99,111,211
27033,Womens Paraphernalia,"Ut venenatis id velit id interdum. Maecenas eu posuere sapien. Integer viverra commodo dui, eu tristique odio efficitur vehicula. Mauris vitae nulla interdum, consectetur nunc eu, maximus nibh. Curabitur id est egestas neque mattis laoreet vel vitae lectus. Quisque et tortor in justo venenatis facilisis a ac quam. Proin pellentesque ac velit a bibendum. Quisque varius semper orci, sit amet auctor metus venenatis sed. Mauris orci ex, convallis efficitur dapibus id, viverra ac nibh.",153,159.95,111.99,184
55635,Vitamin Supplies,"Fusce interdum, ipsum in hendrerit convallis, orci sem ornare ante, nec tincidunt urna augue ac metus. Maecenas pharetra id dui eu semper. Suspendisse sodales tempor odio, quis luctus massa gravida ac. Integer aliquet faucibus pulvinar. Etiam dui nunc, sodales ultrices laoreet vel, varius vel purus. Phasellus suscipit, urna sed mollis rhoncus, lectus ipsum tempus nisl, et gravida ipsum purus quis nisi. Sed leo arcu, venenatis quis blandit eu, hendrerit ut arcu. Praesent nec consectetur ligula. Curabitur sodales mauris non mi auctor, eu feugiat massa vulputate.",156,53.99,31.95,137
62528,Tire Implement,"Proin finibus risus ut dui vulputate malesuada. Maecenas aliquet egestas aliquet. Morbi dignissim ipsum orci, sit amet malesuada tortor venenatis tempor. Pellentesque molestie elementum nisl, at finibus nisi rutrum quis. Nam in est id purus laoreet tincidunt nec nec justo. Suspendisse porta, orci nec varius convallis, orci erat pellentesque libero, dictum venenatis tortor nunc eget neque. Fusce quis vulputate ante, non iaculis mauris. Phasellus sed est eros. Suspendisse sem justo, iaculis ut urna suscipit, cursus gravida libero. Donec vehicula porttitor nibh et posuere. Phasellus tempus justo a lectus vulputate, auctor accumsan libero interdum.",164,34,30.99,142
54538,Medicine Apparatus,"Morbi ac ligula auctor, dictum orci ac, malesuada est. Nullam malesuada nulla tellus, a condimentum nulla pulvinar vel. Nunc cursus posuere sapien ut scelerisque. Suspendisse eget facilisis nibh, nec sollicitudin massa. Nulla facilisi. In sollicitudin, tellus nec vehicula luctus, sem lacus cursus felis, ac fringilla ante nisi ac sapien. Sed venenatis maximus bibendum. Quisque erat odio, laoreet ac molestie sed, molestie cursus ligula. Nam ac magna id erat placerat hendrerit.",221,155.99,93,132
51968,Biking Tool,"Pellentesque dictum ante vitae tempor sodales. Phasellus sed egestas felis, id sagittis ipsum. Sed pharetra non urna quis luctus. Aenean iaculis iaculis augue, eget rutrum justo aliquet dapibus. Proin convallis vel tellus a bibendum. Duis sagittis ultrices orci vitae feugiat. Donec vehicula cursus diam at varius. Sed non varius nunc, at gravida est. Cras sodales varius metus ut dignissim. In hac habitasse platea dictumst. Aliquam diam quam, consequat et vestibulum vel, elementum nec elit. Nulla et viverra felis. In eget dolor non metus fermentum scelerisque.",24,102.95,91,224
55694,Beach Gadget,"Suspendisse dignissim tincidunt odio sed tempus. Fusce at nunc orci. Donec tempor tempus consectetur. Curabitur ullamcorper orci a eros ultrices vestibulum. Integer mollis odio efficitur, finibus magna et, sollicitudin lorem. Mauris interdum vitae quam ac ornare. Sed tellus est, iaculis quis justo vitae, fringilla consectetur nibh. Ut eleifend vehicula tempus. In gravida dolor dolor, id volutpat dui condimentum eu. Quisque iaculis lobortis porta. Donec tincidunt fringilla pretium. Interdum et malesuada fames ac ante ipsum primis in faucibus. Nullam sit amet efficitur nunc. Nulla efficitur lectus fermentum diam auctor vestibulum.",38,26.99,20.95,9
41510,Camera Rig,"Sed nec dictum sem. Pellentesque dictum ante ac quam lobortis placerat. Suspendisse consectetur, sapien consectetur ornare venenatis, ante quam mollis lorem, a vehicula est enim sed quam. Etiam volutpat lacus diam, in elementum erat pharetra eget. Pellentesque lacus nisi, dapibus non volutpat non, lacinia nec nulla. Fusce eget purus suscipit, sagittis lacus sed, posuere mauris. Vivamus porttitor elementum iaculis. Nam id iaculis erat. Maecenas sit amet leo a magna aliquam suscipit id ut dolor. Cras vulputate nisl a scelerisque bibendum. In condimentum viverra congue. Fusce vitae ex vitae dolor venenatis aliquet. Vivamus id blandit lectus, eget vehicula nulla. Quisque laoreet ullamcorper consequat. Donec vitae risus vel lacus eleifend scelerisque.",107,164.95,147.95,190
