code,title,description,quantity,price,cost,sold
49596,Outdoors Component,"Proin sapien tortor, fermentum eu ante vel, faucibus euismod tellus. Aenean pretium mauris id velit elementum, eu scelerisque metus condimentum. Vivamus suscipit dolor in nisi dapibus fermentum. Mauris tortor augue, commodo sit amet ipsum ac, porttitor aliquet augue. Class aptent taciti sociosqu ad litora torquent per conubia nostra, per inceptos himenaeos. Vivamus facilisis ornare justo, sed faucibus quam ornare ac. In hac habitasse platea dictumst. Proin vitae ligula ut enim gravida viverra. Etiam purus leo, consequat ut congue a, posuere eu quam. Aenean vitae consequat elit. Pellentesque id ultricies ante, vel feugiat ipsum. Aenean pulvinar tincidunt neque, eget rhoncus nulla congue ut. Donec nulla urna, maximus ut tellus in, accumsan mollis sem.",166,69.95,55.95,210
43494,Bath Implement,"In molestie tortor sit amet orci dapibus, sed pellentesque velit laoreet. Suspendisse blandit mauris finibus sapien pulvinar, nec bibendum ligula tempus. Praesent vitae maximus quam. Morbi at mattis lorem. Nullam cursus consectetur odio, eget convallis ante semper id. Praesent eget velit quam. Nulla et lectus tellus. Aliquam ultrices, est vitae vestibulum scelerisque, urna purus vulputate neque, eu laoreet quam sapien non massa. Nam porttitor sagittis elementum. Cras posuere fermentum justo, at mollis ipsum semper a. Donec id suscipit ipsum, eu ullamcorper turpis. Aenean laoreet nulla id quam fermentum facilisis. Vivamus mauris quam, accumsan at metus ut, ullamcorper luctus sem. Suspendisse in purus semper, suscipit urna nec, tempus lorem. Vivamus venenatis tempus nulla. Mauris sem erat, fringilla id lectus sit amet, vestibulum tempor arcu.",80,57.99,34.99,230
45574,Furniture Component,"Ut eleifend ultricies est quis imperdiet. Mauris convallis felis at nibh accumsan, faucibus ultricies felis porta. Integer egestas eu odio at porta. In magna sem, tincidunt ultrices efficitur rutrum, facilisis sit amet nibh. Nunc vel efficitur purus. Integer laoreet purus eget enim imperdiet ultrices. Aenean varius nisi in ex mollis euismod.",110,133.99,119.95,246
30825,Fitness Thingamajig,"Phasellus eu pulvinar tortor. Donec nec purus et massa hendrerit finibus. Sed eu felis pretium, tincidunt risus quis, tempus lorem. Duis consequat vel erat placerat elementum. Donec sodales maximus lectus, vitae blandit eros congue a. Pellentesque dignissim mi a sem dapibus eleifend. Sed eu dignissim diam. Pellentesque posuere imperdiet maximus. Fusce quis dui sed ligula viverra tempus in ac orci. Curabitur tincidunt placerat ante, ac venenatis tellus ullamcorper cursus.",119,135.95,94.99,108
34312,Kitchen Paraphernalia,"Phasellus ut ante eleifend, ultrices massa non, varius diam. Nulla vestibulum maximus justo eget efficitur. Vivamus interdum bibendum sapien, quis aliquam diam ultricies nec. Nunc dui metus, ultricies vel orci ut, scelerisque consectetur magna. Nam commodo pulvinar augue vel euismod. Quisque nibh odio, posuere sed molestie eu, mollis nec velit. Praesent sit amet tempor libero. Donec eu lorem lectus. Nam scelerisque eleifend lorem ut efficitur.",252,110,66.95,36
15744,Furniture Kit,"Suspendisse ac nibh lacinia, maximus magna id, auctor erat. Proin auctor ultrices erat, id blandit arcu maximus vitae. Phasellus eu urna sapien. Vestibulum ornare arcu est. Integer viverra venenatis mauris, a pharetra dolor accumsan a. Nunc porta egestas arcu. Nunc quis odio id augue scelerisque finibus. Donec ultrices in felis in tincidunt. Integer pharetra massa at aliquet vestibulum. Lorem ipsum dolor sit amet, consectetur adipiscing elit. Nullam aliquet justo eu tortor vehicula tincidunt. Vestibulum commodo, purus sit amet sollicitudin tincidunt, eros nibh lobortis massa, at blandit lectus turpis quis nulla. Proin accumsan tortor euismod tincidunt fringilla. Nunc a augue ante. Proin posuere dolor non turpis mattis varius. Suspendisse porttitor ornare rhoncus.",153,13.99,9.99,132
48103,Skin Care Supplies,"In molestie tortor sit amet orci dapibus, sed pellentesque velit laoreet. Suspendisse blandit mauris finibus sapien pulvinar, nec bibendum ligula tempus. Praesent vitae maximus quam. Morbi at mattis lorem. Nullam cursus consectetur odio, eget convallis ante semper id. Praesent eget velit quam. Nulla et lectus tellus. Aliquam ultrices, est vitae vestibulum scelerisque, urna purus vulputate neque, eu laoreet quam sapien non massa. Nam porttitor sagittis elementum. Cras posuere fermentum justo, at mollis ipsum semper a. Donec id suscipit ipsum, eu ullamcorper turpis. Aenean laoreet nulla id quam fermentum facilisis. Vivamus mauris quam, accumsan at metus ut, ullamcorper luctus sem. Suspendisse in purus semper, suscipit urna nec, tempus lorem. Vivamus venenatis tempus nulla. Mauris sem erat, fringilla id lectus sit amet, vestibulum tempor arcu.",21,118.99,70.95,135
30493,Cleaning Gizmo,"Praesent nec euismod ex. Cras pharetra auctor imperdiet. Maecenas nisi ipsum, tristique eu metus eu, tincidunt accumsan nibh. Aenean et purus faucibus, fermentum risus eget, posuere diam. Fusce eget orci non sapien gravida sagittis. Curabitur placerat condimentum tortor. Duis cursus feugiat sem, quis convallis mi lobortis vitae. Praesent in dui mi. Ut egestas consectetur massa, vitae vulputate diam feugiat vitae. Nam tincidunt dui massa, et lacinia arcu cursus a. Orci varius natoque penatibus et magnis dis parturient montes, nascetur ridiculus mus. Mauris eu malesuada elit. Praesent accumsan venenatis leo eget tempor. Quisque luctus consequat faucibus.",197,54.95,48.95,140
30717,Cooking Apparatus,"Vestibulum ante ipsum primis in faucibus orci luctus et ultrices posuere cubilia curae; Suspendisse luctus luctus metus et eleifend. Donec pharetra sem congue elementum venenatis. Nulla vitae odio urna. Ut sit amet eros orci. Praesent dictum ac dui a efficitur. Ut non hendrerit velit, nec mattis dolor. Ut venenatis elit quam, eget pulvinar augue finibus sed. Proin mi magna, venenatis eu sagittis vel, porttitor vel velit. Pellentesque nisl lacus, aliquam quis turpis ac, congue mollis arcu. Suspendisse eu nunc consequat, tincidunt diam eget, ornare diam. Curabitur iaculis vitae erat in eleifend.",11,39.99,31.95,43
32812,Phone Tool,"Praesent nec euismod ex. Cras pharetra auctor imperdiet. Maecenas nisi ipsum, tristique eu metus eu, tincidunt accumsan nibh. Aenean et purus faucibus, fermentum risus eget, posuere diam. Fusce eget orci non sapien gravida sagittis. Curabitur placerat condimentum tortor. Duis cursus feugiat sem, quis convallis mi lobortis vitae. Praesent in dui mi. Ut egestas consectetur massa, vitae vulputate diam feugiat vitae. Nam tincidunt dui massa, et lacinia arcu cursus a. Orci varius natoque penatibus et magnis dis parturient montes, nascetur ridiculus mus. Mauris eu malesuada elit. Praesent accumsan venenatis leo eget tempor. Quisque luctus consequat faucibus.",70,149,134.95,233
19687,Camping Implement,In hendrerit dignissim ornare. Fusce et faucibus ipsum. Nullam luctus fringilla accumsan. Morbi in ullamcorper sapien. Morbi id mattis ex. Etiam et enim eros. Integer et metus in diam semper mollis eu quis eros. Phasellus a malesuada nisl.,146,55.99,44.95,188
11951,Medicine Device,"Donec elementum volutpat porttitor. Phasellus eget lectus vitae neque convallis accumsan. Cras aliquam lobortis metus id pulvinar. Pellentesque ut volutpat augue. Phasellus feugiat tristique est, vitae laoreet libero maximus quis. Nam fringilla aliquet tellus ac pretium. Quisque pulvinar augue eget nunc mollis, nec luctus ex lobortis. Phasellus a sagittis justo. Cras placerat sem in eros bibendum dapibus et ut nulla. Nulla cursus libero odio, vel volutpat diam vulputate eu. Proin id dolor dolor. Integer ut vehicula odio, eget rhoncus tellus. Integer quis tristique magna, eu fringilla lorem. Cras vehicula, justo sit amet congue fringilla, quam augue interdum nulla, at pretium massa tellus in arcu. Pellentesque vel suscipit metus.",90,82.95,73.95,30
56407,Cooking Doodad,"Praesent aliquam tellus lobortis arcu rutrum, ac tincidunt arcu egestas. Suspendisse a auctor tortor, in lacinia massa. Suspendisse eleifend vulputate urna vitae ultricies. Praesent gravida convallis ipsum a euismod. Phasellus vitae diam diam. Maecenas ac enim varius, sagittis arcu porta, venenatis felis. Sed luctus metus velit, ut molestie ipsum auctor quis. Etiam malesuada et enim nec gravida. Nunc pharetra lectus odio, non tempus velit dictum et. Suspendisse dignissim mi nec dolor rutrum semper.",108,47.95,28.99,29
12473,Kitchen Kit,"Fusce at nunc lacinia, bibendum neque in, pharetra elit. Fusce orci justo, elementum vel mi sit amet, ultrices tempor eros. Ut placerat massa et velit tempor, id congue urna mollis. Lorem ipsum dolor sit amet, consectetur adipiscing elit. Etiam dignissim neque non mattis blandit. Integer eget placerat erat. Donec tempor lorem ipsum, sed imperdiet sem rhoncus vel. Nullam nulla ligula, malesuada quis enim vel, ultrices dapibus mauris. In et justo non elit molestie dapibus sed eu velit. Donec semper, orci ut cursus egestas, nibh urna fringilla tortor, a blandit tellus libero vitae massa. Suspendisse fermentum ex vel volutpat luctus. Etiam ut venenatis leo.",137,177.99,141.95,89
1195,Game Paraphernalia,"Suspendisse hendrerit ornare lorem ut pulvinar. Aenean dolor felis, venenatis sollicitudin dignissim eu, feugiat sed orci. Mauris suscipit purus sed volutpat dictum. Nam varius magna et dolor tristique pretium. Donec id est consequat, dictum dui sit amet, lobortis ipsum. Proin vulputate pulvinar quam, aliquet iaculis eros pellentesque ac. Donec placerat eu metus a interdum. Phasellus diam felis, vestibulum in ornare et, euismod et dolor. Etiam molestie sed ex et auctor. Nunc ligula mi, scelerisque vitae lobortis vitae, blandit a dolor. Vestibulum quam eros, semper nec sollicitudin et, rhoncus ac nulla. Sed sed suscipit eros, nec posuere nulla. Nulla id mi quis lorem malesuada gravida.",122,167.95,133,57
24042,Swimming Item,"Nunc congue metus in nisi consequat, at elementum tellus laoreet. Ut sodales, mi non ullamcorper facilisis, tortor justo finibus ligula, a cursus arcu sapien vel purus. Vivamus tincidunt quam dapibus mi condimentum, vitae pharetra neque scelerisque. Mauris maximus a dolor vel pretium. Nulla nec gravida sapien. Nulla sodales mi eu neque porta facilisis. Nulla varius placerat auctor. Praesent quis nisl congue dui pretium tempor. Phasellus luctus nibh vestibulum, dignissim ligula vel, tristique libero. Aliquam porta egestas sapien, nec scelerisque felis semper vitae. Duis mauris leo, elementum at felis non, cursus maximus leo. Duis felis nulla, bibendum sit amet elementum vitae, vestibulum in justo. Mauris ipsum dui, tempor sit amet ligula vel, sollicitudin malesuada est. Morbi tristique mauris at arcu interdum ornare. Etiam non mi a sem pharetra varius.",192,185.99,111.99,142
36005,Cat Kit,"Duis fermentum vestibulum elit aliquet pharetra. Aliquam vel malesuada metus. Suspendisse potenti. Morbi semper fermentum mauris, aliquam suscipit metus fermentum nec. Nunc eget libero sed dui iaculis eleifend quis sed tellus. Vivamus aliquet commodo magna id viverra. Morbi vitae neque vitae risus viverra elementum non et tellus. Maecenas laoreet tellus augue, id dictum magna dictum non. Suspendisse lorem augue, dapibus ac arcu quis, molestie accumsan enim. In lacus justo, sollicitudin vel orci vitae, ornare pretium odio. Etiam feugiat maximus nulla ut bibendum.",137,96,67.95,25
47674,First Aid Machine,"Lorem ipsum dolor sit amet, consectetur adipiscing elit. Maecenas vulputate libero eget quam dictum, ac pellentesque enim commodo. Donec tincidunt ligula in nunc fermentum, nec posuere arcu convallis. Pellentesque habitant morbi tristique senectus et netus et malesuada fames ac turpis egestas. Mauris magna risus, scelerisque in lacinia non, pulvinar nec nulla. Duis a sapien mi. Nullam vitae purus a justo venenatis euismod. Donec euismod tincidunt arcu, sit amet euismod purus placerat non. Etiam ac tempus felis. Nulla facilisi. Etiam sodales, nisi eu tincidunt lacinia, massa lectus mollis ligula, eget rutrum enim nibh ac nulla. Vestibulum porta egestas vulputate. Sed non laoreet nisl. Aenean hendrerit venenatis auctor.",15,192.95,134.95,82
7313,Tire Device,"Sed non fermentum erat, et venenatis ipsum. Aliquam eleifend imperdiet volutpat. Aliquam egestas ipsum mauris, et commodo dui consectetur quis. Vestibulum rhoncus nulla quis feugiat interdum. In imperdiet purus metus, id condimentum lectus ultricies vel. Curabitur ut interdum nisi. In sed nunc suscipit, luctus mauris eu, congue sapien. Suspendisse ornare quis odio eget suscipit. In accumsan urna nunc, non mattis enim blandit ut. In ut libero orci. Ut semper velit ut elit ullamcorper, ac vulputate libero rutrum. Praesent justo leo, eleifend a molestie vestibulum, bibendum sit amet leo. Sed interdum et tortor ut laoreet. Nulla in tellus augue. Aenean sit amet felis id purus commodo auctor id non odio. Donec interdum, lorem consectetur condimentum mollis, mauris sem pretium turpis, sed faucibus magna tortor a erat.",183,36.99,21.95,194
55066,Music Paraphernalia,"Ut molestie mollis urna in lobortis. Pellentesque id massa arcu. Pellentesque gravida, quam quis consequat consequat, erat elit faucibus nulla, vel condimentum est nulla ac ligula. Praesent sed ligula dolor. Fusce elementum semper odio, sit amet imperdiet ipsum tincidunt id. Mauris et lectus in velit tristique lacinia. Phasellus rutrum lacus quis sagittis pharetra. Morbi malesuada tellus sed felis euismod, id fringilla arcu posuere. Nunc rutrum dapibus odio vel efficitur. Pellentesque quis dignissim est. Morbi aliquet dui id ex efficitur tincidunt. Maecenas varius diam sit amet eros volutpat, tempor efficitur urna ornare.",58,40.99,28.95,121
50105,Dog Device,"Maecenas aliquet vitae diam vel aliquet. Aliquam a ligula ornare, ullamcorper mauris a, tempor justo. Praesent elementum nibh vitae metus dignissim, vel suscipit lorem volutpat. Nulla at sapien ac erat bibendum tincidunt. Vestibulum lectus odio, egestas eu tellus efficitur, accumsan ullamcorper enim. Nullam lacinia hendrerit ultricies. Interdum et malesuada fames ac ante ipsum primis in faucibus. Nulla non tempus turpis. Fusce consequat mattis faucibus. Maecenas ac mollis sem.",193,82,49,116
18952,Jewelry Equipment,"Fusce at nunc lacinia, bibendum neque in, pharetra elit. Fusce orci justo, elementum vel mi sit amet, ultrices tempor eros. Ut placerat massa et velit tempor, id congue urna mollis. Lorem ipsum dolor sit amet, consectetur adipiscing elit. Etiam dignissim neque non mattis blandit. Integer eget placerat erat. Donec tempor lorem ipsum, sed imperdiet sem rhoncus vel. Nullam nulla ligula, malesuada quis enim vel, ultrices dapibus mauris. In et justo non elit molestie dapibus sed eu velit. Donec semper, orci ut cursus egestas, nibh urna fringilla tortor, a blandit tellus libero vitae massa. Suspendisse fermentum ex vel volutpat luctus. Etiam ut venenatis leo.",28,13.95,7.99,0
29148,Furniture Item,"Sed volutpat porttitor arcu, ac condimentum ligula. Aenean quis imperdiet mauris. Morbi sagittis sodales justo, ac auctor felis sagittis pulvinar. Cras sed arcu tempus, facilisis nisl vitae, convallis sem. Mauris odio dolor, maximus vel auctor et, molestie sed magna. Pellentesque vel ultrices felis. Cras et pulvinar lorem. Nunc dignissim maximus varius. Sed et diam volutpat nisi aliquet tempor. Phasellus non ligula congue, bibendum nisl et, viverra nulla. Maecenas ut lorem quis mi tempor finibus at sit amet dolor. Proin auctor urna sed erat lacinia, et aliquam lacus hendrerit. Cras diam sapien, dapibus non mi nec, pretium lobortis diam. Duis interdum lacinia felis, ultrices venenatis ex pharetra sit amet. Vestibulum sollicitudin dignissim mauris, vitae aliquet nisi vestibulum vitae.",198,14.95,9.99,137
48998,Nutrition Mechanism,"Nulla orci mi, dapibus vel tempor vulputate, luctus at quam. Curabitur tempus sed mi eget pretium. Sed vitae eleifend nibh. Integer luctus orci vel metus elementum, sit amet rutrum nisi cursus. Cras sagittis eu magna et bibendum. Aliquam erat volutpat. Pellentesque sollicitudin ornare egestas. Fusce libero quam, elementum non auctor ultricies, vulputate non sem. Integer tristique est a lorem consectetur tempor.",200,71.99,49.95,207
42092,Phone Whatchamacallit,"Morbi ac ligula auctor, dictum orci ac, malesuada est. Nullam malesuada nulla tellus, a condimentum nulla pulvinar vel. Nunc cursus posuere sapien ut scelerisque. Suspendisse eget facilisis nibh, nec sollicitudin massa. Nulla facilisi. In sollicitudin, tellus nec vehicula luctus, sem lacus cursus felis, ac fringilla ante nisi ac sapien. Sed venenatis maximus bibendum. Quisque erat odio, laoreet ac molestie sed, molestie cursus ligula. Nam ac magna id erat placerat hendrerit.",90,24,19.95,163
2822,Technology Rig,"Suspendisse condimentum velit non purus varius, auctor maximus est aliquam. Aliquam volutpat arcu id justo fringilla posuere. Maecenas massa metus, blandit at varius vel, fermentum vitae odio. Ut non metus maximus, suscipit metus et, mattis dui. Duis vestibulum velit eget tempus pretium. Duis elit diam, finibus et lectus nec, auctor malesuada neque. Fusce congue faucibus consequat.",187,45.99,36.99,119
18678,Fitness Device,"Suspendisse eros enim, iaculis sodales auctor et, tincidunt quis enim. Integer leo nisi, fringilla sed porta non, convallis non mi. Aenean erat tortor, vehicula vitae mattis non, elementum vel urna. Fusce efficitur felis sed dui mollis, euismod vehicula purus eleifend. Ut tempor risus eget nisi suscipit porta. Maecenas molestie imperdiet purus, eget imperdiet velit convallis sed. Aliquam venenatis hendrerit malesuada. Mauris id felis turpis. Nunc pretium nisi aliquam rutrum elementum. Sed malesuada massa quis ipsum commodo fermentum. Sed id nulla velit.",170,152.99,136.99,37
51189,Fitness Rig,"Etiam neque libero, semper sed ex eu, rutrum dignissim diam. Maecenas nisi libero, dignissim nec faucibus nec, elementum vitae neque. Phasellus a augue lacus. Maecenas ac porttitor justo. Quisque lacus urna, tristique quis ex vel, ullamcorper suscipit nibh. Donec ut purus lacus. Interdum et malesuada fames ac ante ipsum primis in faucibus. Etiam vitae ex vel tortor viverra dictum a nec arcu.",36,182,145.99,102
35045,Movie Item,"Aenean id posuere urna. Phasellus vehicula est ex, elementum consequat dui ornare non. Suspendisse libero risus, vulputate vitae ultricies nec, placerat ac tortor. Donec tincidunt ornare metus. Nunc nunc dolor, egestas in odio in, mattis facilisis est. Sed ac ligula eget orci consectetur interdum. Fusce elit metus, consequat ut tortor sit amet, porttitor feugiat nisl. Donec tempus maximus purus et ultricies. Nunc pretium elit non felis placerat placerat. Suspendisse cursus diam nulla, eu pellentesque ipsum viverra at. Nulla sit amet maximus lorem.",83,147.95,132.95,134
6019,Makeup Attachment,"Vestibulum lacinia massa nec viverra vulputate. Cras a ante sem. Morbi interdum lobortis lacus id ullamcorper. Integer pellentesque fringilla libero quis cursus. Curabitur vitae dictum nibh, non accumsan turpis. Quisque aliquam nec nibh a aliquam. Curabitur nunc arcu, rutrum eget mattis id, semper in mi. In arcu augue, commodo sit amet finibus eget, dignissim in quam. Nulla sollicitudin enim in nibh venenatis, in cursus dui hendrerit. Morbi at mollis nulla.",80,167.99,100,126
25951,Medicine Supplies,"Donec sed enim nulla. Phasellus molestie justo a metus pellentesque finibus. Vivamus justo nulla, tempus et magna et, cursus scelerisque turpis. Curabitur vulputate quam sit amet orci semper, vel efficitur ipsum tempor. Donec a sapien dictum, porttitor nibh ut, tempus urna. Nunc vel dignissim mauris. Nam sit amet purus id velit imperdiet luctus et ut lorem. Aenean dignissim urna et ante ullamcorper, eget finibus lorem feugiat. Curabitur dapibus ultricies felis, vel ullamcorper erat ultrices eu.",32,103.95,72,14
36034,Book Paraphernalia,"Duis sodales dignissim leo vitae convallis. Praesent rhoncus pulvinar lectus quis suscipit. Vestibulum ante ipsum primis in faucibus orci luctus et ultrices posuere cubilia curae; Nunc ut elementum neque. Cras est ipsum, molestie vel vulputate vulputate, iaculis ac tellus. Nulla consectetur non ante et auctor. Etiam sodales lectus vel lectus scelerisque pretium ut sed felis. Maecenas congue felis vitae sapien dignissim rutrum. Proin in mi ex.",224,38,30.95,109
13675,Dining Attachment,"Phasellus eu pulvinar tortor. Donec nec purus et massa hendrerit finibus. Sed eu felis pretium, tincidunt risus quis, tempus lorem. Duis consequat vel erat placerat elementum. Donec sodales maximus lectus, vitae blandit eros congue a. Pellentesque dignissim mi a sem dapibus eleifend. Sed eu dignissim diam. Pellentesque posuere imperdiet maximus. Fusce quis dui sed ligula viverra tempus in ac orci. Curabitur tincidunt placerat ante, ac venenatis tellus ullamcorper cursus.",204,75.95,52.99,224
3538,Toy Instrument,"Vivamus eu lacus magna. Fusce sollicitudin maximus ante sed semper. Nulla facilisi. Suspendisse ultricies mi eget nisi vehicula, at aliquam nunc interdum. Nulla neque tellus, ultrices non consequat vitae, vehicula vulputate orci. Vivamus iaculis urna non enim maximus condimentum. Aliquam porttitor egestas viverra. Suspendisse elementum magna mauris, vitae vestibulum orci porttitor quis. Interdum et malesuada fames ac ante ipsum primis in faucibus. Pellentesque vehicula efficitur libero. In bibendum scelerisque lectus, sed vulputate diam gravida nec. Nulla congue bibendum velit dictum pulvinar. Cras pharetra libero a tempor tincidunt. Mauris eget ullamcorper nibh.",162,30.95,24.99,241
4845,Vitamin Gadget,"Praesent aliquam tellus lobortis arcu rutrum, ac tincidunt arcu egestas. Suspendisse a auctor tortor, in lacinia massa. Suspendisse eleifend vulputate urna vitae ultricies. Praesent gravida convallis ipsum a euismod. Phasellus vitae diam diam. Maecenas ac enim varius, sagittis arcu porta, venenatis felis. Sed luctus metus velit, ut molestie ipsum auctor quis. Etiam malesuada et enim nec gravida. Nunc pharetra lectus odio, non tempus velit dictum et. Suspendisse dignissim mi nec dolor rutrum semper.",255,190,114,62
60538,Party Contraption,"Ut eleifend ultricies est quis imperdiet. Mauris convallis felis at nibh accumsan, faucibus ultricies felis porta. Integer egestas eu odio at porta. In magna sem, tincidunt ultrices efficitur rutrum, facilisis sit amet nibh. Nunc vel efficitur purus. Integer laoreet purus eget enim imperdiet ultrices. Aenean varius nisi in ex mollis euismod.",237,162.95,145.99,26
41028,Home Improvement Item,"Cras suscipit erat sapien, id elementum erat porta eget. Donec sagittis auctor nisi, id bibendum neque ultrices eget. Suspendisse potenti. Orci varius natoque penatibus et magnis dis parturient montes, nascetur ridiculus mus. Curabitur vitae nibh enim. Ut mollis ligula quis nisi venenatis, eget venenatis tellus ultricies. Fusce nec diam aliquet, faucibus erat in, accumsan arcu. Phasellus nec nulla eget leo pharetra aliquet ut id eros. Proin interdum, nibh tincidunt varius facilisis, libero ante maximus urna, nec pulvinar tortor elit in diam. Lorem ipsum dolor sit amet, consectetur adipiscing elit. Nullam quis sem placerat, dictum massa sit amet, rhoncus dolor. Etiam massa massa, blandit non vehicula sit amet, tincidunt sed lectus. Fusce pellentesque id eros eu pellentesque. Morbi eget rhoncus sem.",26,43,38.99,134
39268,Aquarium Equipment,"Maecenas maximus condimentum efficitur. Phasellus vitae ullamcorper lectus, non mattis augue. Phasellus vel efficitur ipsum. Praesent tempus porttitor ante, ut efficitur diam mollis vel. Vestibulum quis accumsan turpis. Integer accumsan, felis quis fringilla dignissim, nisl magna pulvinar lacus, nec aliquam mauris enim ut risus. In ultrices tempus nibh, rutrum dictum quam faucibus quis. Donec ut nunc nec nisl elementum consectetur.",51,15.95,12.95,230
37818,First Aid Item,"Aenean id posuere urna. Phasellus vehicula est ex, elementum consequat dui ornare non. Suspendisse libero risus, vulputate vitae ultricies nec, placerat ac tortor. Donec tincidunt ornare metus. Nunc nunc dolor, egestas in odio in, mattis facilisis est. Sed ac ligula eget orci consectetur interdum. Fusce elit metus, consequat ut tortor sit amet, porttitor feugiat nisl. Donec tempus maximus purus et ultricies. Nunc pretium elit non felis placerat placerat. Suspendisse cursus diam nulla, eu pellentesque ipsum viverra at. Nulla sit amet maximus lorem.",7,127,114.99,25
2013,Tire Gear,"Sed nec dictum sem. Pellentesque dictum ante ac quam lobortis placerat. Suspendisse consectetur, sapien consectetur ornare venenatis, ante quam mollis lorem, a vehicula est enim sed quam. Etiam volutpat lacus diam, in elementum erat pharetra eget. Pellentesque lacus nisi, dapibus non volutpat non, lacinia nec nulla. Fusce eget purus suscipit, sagittis lacus sed, posuere mauris. Vivamus porttitor elementum iaculis. Nam id iaculis erat. Maecenas sit amet leo a magna aliquam suscipit id ut dolor. Cras vulputate nisl a scelerisque bibendum. In condimentum viverra congue. Fusce vitae ex vitae dolor venenatis aliquet. Vivamus id blandit lectus, eget vehicula nulla. Quisque laoreet ullamcorper consequat. Donec vitae risus vel lacus eleifend scelerisque.",32,98.95,68,95
