code,title,description,quantity,price,cost,sold
19419,Sports Thingamajig,"Suspendisse placerat non erat quis aliquam. Maecenas pulvinar sollicitudin pretium. Class aptent taciti sociosqu ad litora torquent per conubia nostra, per inceptos himenaeos. In gravida ligula in sapien blandit volutpat. Suspendisse porttitor dolor et neque condimentum, non consequat ligula commodo. Aenean ultricies nisl mauris, ac gravida dolor tempus et. Nullam et malesuada justo, ac scelerisque libero. Sed ultrices nunc enim. Integer posuere nulla egestas dignissim faucibus. Integer egestas augue quis sodales dictum.",199,160,96.95,132
38698,Cleaning Supplies,"In hac habitasse platea dictumst. Pellentesque eleifend ante quis magna gravida rhoncus. Nullam ut lorem eu ipsum elementum convallis id sit amet mauris. Praesent ac nulla et nibh fringilla ultricies. Pellentesque mauris ante, congue ut arcu sit amet, varius eleifend erat. Class aptent taciti sociosqu ad litora torquent per conubia nostra, per inceptos himenaeos. Maecenas ac enim lectus. Quisque arcu risus, laoreet dictum massa nec, aliquam hendrerit dui. Proin molestie augue sit amet fermentum mattis. Ut rhoncus malesuada eleifend. Integer viverra lobortis malesuada. Fusce at arcu non orci hendrerit tincidunt. In mattis pulvinar ex in lobortis.",239,30.95,24,59
5873,Truck Item,"Sed nec dictum sem. Pellentesque dictum ante ac quam lobortis placerat. Suspendisse consectetur, sapien consectetur ornare venenatis, ante quam mollis lorem, a vehicula est enim sed quam. Etiam volutpat lacus diam, in elementum erat pharetra eget. Pellentesque lacus nisi, dapibus non volutpat non, lacinia nec nulla. Fusce eget purus suscipit, sagittis lacus sed, posuere mauris. Vivamus porttitor elementum iaculis. Nam id iaculis erat. Maecenas sit amet leo a magna aliquam suscipit id ut dolor. Cras vulputate nisl a scelerisque bibendum. In condimentum viverra congue. Fusce vitae ex vitae dolor venenatis aliquet. Vivamus id blandit lectus, eget vehicula nulla. Quisque laoreet ullamcorper consequat. Donec vitae risus vel lacus eleifend scelerisque.",103,86.99,60.95,17
58951,Nutrition Machine,"Suspendisse placerat non erat quis aliquam. Maecenas pulvinar sollicitudin pretium. Class aptent taciti sociosqu ad litora torquent per conubia nostra, per inceptos himenaeos. In gravida ligula in sapien blandit volutpat. Suspendisse porttitor dolor et neque condimentum, non consequat ligula commodo. Aenean ultricies nisl mauris, ac gravida dolor tempus et. Nullam et malesuada justo, ac scelerisque libero. Sed ultrices nunc enim. Integer posuere nulla egestas dignissim faucibus. Integer egestas augue quis sodales dictum.",235,143.99,128.95,25
48701,Medicine Rig,"Donec auctor id lorem et condimentum. Pellentesque convallis turpis in felis gravida sollicitudin. Suspendisse quam erat, euismod eget velit sed, elementum venenatis lacus. Nunc ac ligula urna. Fusce interdum vehicula libero ac blandit. Morbi libero sem, fringilla ac nunc non, cursus pulvinar erat. Pellentesque rutrum lectus eu massa tempor hendrerit. Nulla non odio eget orci rhoncus tempor id at enim.",98,199.95,179.99,52
9636,Kitchen Kit,"Ut molestie mollis urna in lobortis. Pellentesque id massa arcu. Pellentesque gravida, quam quis consequat consequat, erat elit faucibus nulla, vel condimentum est nulla ac ligula. Praesent sed ligula dolor. Fusce elementum semper odio, sit amet imperdiet ipsum tincidunt id. Mauris et lectus in velit tristique lacinia. Phasellus rutrum lacus quis sagittis pharetra. Morbi malesuada tellus sed felis euismod, id fringilla arcu posuere. Nunc rutrum dapibus odio vel efficitur. Pellentesque quis dignissim est. Morbi aliquet dui id ex efficitur tincidunt. Maecenas varius diam sit amet eros volutpat, tempor efficitur urna ornare.",144,119.95,83.99,181
3534,Jewelry Device,"Donec auctor id lorem et condimentum. Pellentesque convallis turpis in felis gravida sollicitudin. Suspendisse quam erat, euismod eget velit sed, elementum venenatis lacus. Nunc ac ligula urna. Fusce interdum vehicula libero ac blandit. Morbi libero sem, fringilla ac nunc non, cursus pulvinar erat. Pellentesque rutrum lectus eu massa tempor hendrerit. Nulla non odio eget orci rhoncus tempor id at enim.",9,22.95,19.95,40
45920,Jewelry Rig,"Vivamus eu lacus magna. Fusce sollicitudin maximus ante sed semper. Nulla facilisi. Suspendisse ultricies mi eget nisi vehicula, at aliquam nunc interdum. Nulla neque tellus, ultrices non consequat vitae, vehicula vulputate orci. Vivamus iaculis urna non enim maximus condimentum. Aliquam porttitor egestas viverra. Suspendisse elementum magna mauris, vitae vestibulum orci porttitor quis. Interdum et malesuada fames ac ante ipsum primis in faucibus. Pellentesque vehicula efficitur libero. In bibendum scelerisque lectus, sed vulputate diam gravida nec. Nulla congue bibendum velit dictum pulvinar. Cras pharetra libero a tempor tincidunt. Mauris eget ullamcorper nibh.",15,135.95,94,56
42756,Medicine Instrument,"Vivamus fringilla dui quis mi iaculis, eget sodales arcu vulputate. Vivamus sit amet fringilla massa, id maximus libero. Praesent sit amet ex eget massa malesuada laoreet ac non sapien. Nulla vestibulum fringilla nulla, eget ornare urna hendrerit quis. Nulla est augue, lobortis sed magna vitae, dapibus ultrices libero. Aliquam sed feugiat sem. Mauris nunc mauris, pellentesque sit amet erat a, rhoncus placerat purus. Nullam viverra elit lectus, ac pellentesque lorem porttitor vulputate. Phasellus varius dapibus nisi a egestas. Etiam ut purus nunc. Aliquam ultricies, felis vel gravida facilisis, lorem quam blandit diam, vestibulum interdum quam lacus at urna. Maecenas sed justo ipsum.",238,108.95,64.95,129
18191,Camping Gizmo,"Etiam neque libero, semper sed ex eu, rutrum dignissim diam. Maecenas nisi libero, dignissim nec faucibus nec, elementum vitae neque. Phasellus a augue lacus. Maecenas ac porttitor justo. Quisque lacus urna, tristique quis ex vel, ullamcorper suscipit nibh. Donec ut purus lacus. Interdum et malesuada fames ac ante ipsum primis in faucibus. Etiam vitae ex vel tortor viverra dictum a nec arcu.",18,109,65.95,17
18422,Outdoors Supplies,"Sed ac commodo ligula. Morbi suscipit mi eget tortor euismod, a congue nibh finibus. Ut dapibus ut odio sit amet vehicula. Nulla congue posuere ligula ac pulvinar. Suspendisse potenti. Nulla libero odio, suscipit ut mattis non, tempor molestie diam. Nam sed ex mollis, luctus nisi at, rhoncus sapien. Integer eu ligula metus. Orci varius natoque penatibus et magnis dis parturient montes, nascetur ridiculus mus.",68,78.99,62.99,250
51180,Dog Device,"Nulla orci mi, dapibus vel tempor vulputate, luctus at quam. Curabitur tempus sed mi eget pretium. Sed vitae eleifend nibh. Integer luctus orci vel metus elementum, sit amet rutrum nisi cursus. Cras sagittis eu magna et bibendum. Aliquam erat volutpat. Pellentesque sollicitudin ornare egestas. Fusce libero quam, elementum non auctor ultricies, vulputate non sem. Integer tristique est a lorem consectetur tempor.",133,69.95,48,206
44874,Music Component,"In hac habitasse platea dictumst. Pellentesque eleifend ante quis magna gravida rhoncus. Nullam ut lorem eu ipsum elementum convallis id sit amet mauris. Praesent ac nulla et nibh fringilla ultricies. Pellentesque mauris ante, congue ut arcu sit amet, varius eleifend erat. Class aptent taciti sociosqu ad litora torquent per conubia nostra, per inceptos himenaeos. Maecenas ac enim lectus. Quisque arcu risus, laoreet dictum massa nec, aliquam hendrerit dui. Proin molestie augue sit amet fermentum mattis. Ut rhoncus malesuada eleifend. Integer viverra lobortis malesuada. Fusce at arcu non orci hendrerit tincidunt. In mattis pulvinar ex in lobortis.",134,36.99,32,92
56380,Dining Apparatus,"Nulla non nibh ante. Interdum et malesuada fames ac ante ipsum primis in faucibus. Mauris nec molestie tortor. Duis venenatis ipsum ut magna porta, quis posuere eros euismod. Morbi sodales dui vitae tristique tincidunt. Nam cursus placerat augue, a semper eros gravida bibendum. Proin sem ante, dignissim eget urna sit amet, pharetra aliquet odio. Duis efficitur consequat quam, id pulvinar justo tempor at. In feugiat urna at ipsum pulvinar rutrum. Vestibulum at tristique neque, ut cursus nulla. Proin rutrum sodales lacinia. Sed id convallis tellus. Nunc ut ultrices orci, in lacinia velit. Quisque sit amet orci finibus, pulvinar arcu eu, vehicula nulla. Quisque ligula ipsum, sollicitudin feugiat consequat ut, elementum in ligula. Vivamus sapien lacus, mollis vel urna non, finibus finibus ligula.",163,98.95,58.95,87
28739,Vitamin Gear,"Phasellus eget fringilla justo. Integer sem mauris, viverra non ligula sagittis, consectetur pharetra tortor. Donec et varius leo. Lorem ipsum dolor sit amet, consectetur adipiscing elit. Etiam pharetra mollis ante, eget vestibulum turpis vestibulum vel. Donec dictum, tellus vitae fermentum egestas, erat leo tristique orci, ut aliquet lectus massa sed mauris. Integer viverra hendrerit nisl a vulputate. Pellentesque finibus auctor nisl, nec aliquet magna cursus ut.",165,90.99,54.95,211
21459,Fitness Item,"Suspendisse facilisis, magna quis laoreet interdum, ligula elit porta augue, nec malesuada eros sapien eu nisl. In sed lacus ac mi placerat congue. Suspendisse massa orci, iaculis id facilisis tempus, gravida in est. Vestibulum eu lacus eget massa dignissim efficitur vitae malesuada leo. Quisque ultricies massa turpis, quis venenatis justo vehicula vel. Donec eu cursus turpis. Aliquam vel vulputate eros, eget faucibus elit. Phasellus vel egestas orci, vel cursus neque. Suspendisse feugiat sapien orci. Curabitur rhoncus ultricies laoreet. In vitae euismod tortor, sed rutrum lorem. Vivamus at augue scelerisque, bibendum est vel, aliquam ligula. Aliquam sagittis ornare neque, sed fermentum nisi cursus ut. Donec purus arcu, convallis eget eros dapibus, euismod malesuada diam. Vivamus congue, metus in fringilla facilisis, ante orci posuere turpis, nec malesuada massa nisi dignissim mi. Donec sed augue lectus.",78,63.99,37,249
30496,Cooking Machine,"Nulla orci mi, dapibus vel tempor vulputate, luctus at quam. Curabitur tempus sed mi eget pretium. Sed vitae eleifend nibh. Integer luctus orci vel metus elementum, sit amet rutrum nisi cursus. Cras sagittis eu magna et bibendum. Aliquam erat volutpat. Pellentesque sollicitudin ornare egestas. Fusce libero quam, elementum non auctor ultricies, vulputate non sem. Integer tristique est a lorem consectetur tempor.",71,145.95,116.99,156
